{
  "schemaVersion": 1,
  "id": "telegram",
  "displayName": "Telegram Android and Desktop",
  "status": "experimental",
  "themeVersion": "4.0.0",
  "tokenDigest": "sha256-3KBrfmIiz4L6Qyqvi99TdTe4+5NeuA0ZWZe3Am4sRo4=",
  "profile": "default",
  "format": "telegram-theme",
  "targetVersions": [
    "Telegram Android 12.10.6",
    "Telegram Desktop 7.2.9"
  ],
  "testedVersions": [
    "Telegram Android 12.10.6",
    "Telegram Desktop 7.2.9"
  ],
  "os": [
    "android",
    "windows",
    "linux",
    "macos"
  ],
  "surfaces": {
    "supported": [
      "interface",
      "messages",
      "controls",
      "wallpaper"
    ],
    "inherited": [
      "typography",
      "motion",
      "content-data"
    ],
    "unsupported": [
      "geometry"
    ]
  },
  "files": [
    {
      "path": "dist/j3w1.attheme",
      "install": "File install: open in Telegram for Android (or send to Saved Messages and tap), then Apply. Cloud publication and automatic updates require the separate owner steps in the guide; the current files await a new import check."
    },
    {
      "path": "dist/j3w1.tdesktop-theme",
      "install": "File install: open with Telegram Desktop, then Apply this theme and Keep changes. Cloud publication and automatic updates require the separate owner steps in the guide; the current files await a new import check."
    }
  ],
  "mappingPath": "mapping.json",
  "capabilitiesPath": "capabilities.json",
  "evidence": [
    {
      "kind": "report",
      "path": "evidence/2026-10-06-acceptance.md",
      "app": "Telegram Android 12.10.6",
      "os": "Android (owner phone, arm64-v8a)",
      "date": "2026-10-06",
      "artifactDigest": "sha256-Mwz/btpvJeVTCuZhJat4ivpBOHgcIh1q7sJI7391BwU="
    },
    {
      "kind": "report",
      "path": "evidence/2026-10-06-acceptance.md",
      "app": "Telegram Desktop 7.2.9",
      "os": "Windows (owner ROG Ally)",
      "date": "2026-10-06",
      "artifactDigest": "sha256-hJpqFP1ooc8qTc4hnNgcLD96onL8pnwcsGSHRZLDUHo="
    }
  ]
}
